{
  "$schema": "https://json-schema.org/draft/2020-12/schema",
  "$id": "https://rvbbit.dev/schemas/pack.schema.json",
  "title": "Rvbbit Capability Pack",
  "type": "object",
  "required": ["api_version", "id", "name", "capability"],
  "additionalProperties": false,
  "properties": {
    "api_version": {
      "type": "string",
      "const": "rvbbit.pack/v1"
    },
    "id": {
      "type": "string",
      "pattern": "^[A-Za-z0-9_./-]+$"
    },
    "name": {
      "type": "string",
      "pattern": "^[a-z][a-z0-9_\\-]*$"
    },
    "title": {
      "type": "string"
    },
    "description": {
      "type": "string"
    },
    "license": {
      "type": "string"
    },
    "tags": {
      "type": "array",
      "items": { "type": "string" }
    },
    "repo_url": {
      "type": "string"
    },
    "catalog_visibility": {
      "type": "string",
      "enum": ["public", "example", "internal"],
      "default": "public"
    },
    "catalog_url": {
      "type": "string",
      "format": "uri"
    },
    "catalog_refresh_seconds": {
      "type": "integer",
      "minimum": 60
    },
    "catalog_seed_snapshot": {
      "type": "boolean",
      "default": false
    },
    "system_runtime": {
      "type": "boolean",
      "default": false
    },
    "capability_role": {
      "type": "string",
      "enum": ["model_capability", "system_runtime", "operator_runtime"]
    },
    "capability": {
      "type": "string"
    },
    "source": {
      "type": "object",
      "additionalProperties": false,
      "properties": {
        "provider": { "type": "string" },
        "model": { "type": "string" },
        "revision": { "type": "string" },
        "url": { "type": "string" }
      }
    },
    "runtime": {
      "type": "object",
      "additionalProperties": false,
      "properties": {
        "mode": { "type": "string", "enum": ["image", "build", "external", "sql"] },
        "image": { "type": "string" },
        "image_digest": { "type": "string" },
        "template": { "type": "string" },
        "handler": { "type": "string" },
        "device": { "type": "string" },
        "port": { "type": "integer", "minimum": 1, "maximum": 65535 },
        "health_path": { "type": "string" }
      }
    },
    "resources": {
      "type": "object",
      "additionalProperties": false,
      "properties": {
        "gpu": {
          "type": "object",
          "additionalProperties": false,
          "properties": {
            "required": { "type": "boolean" },
            "placement": { "type": "string", "enum": ["single_gpu"] },
            "model_size_bytes": { "type": "integer", "minimum": 0 },
            "vram_required_bytes": { "type": "integer", "minimum": 0 },
            "headroom_pct": { "type": "number", "minimum": 0 },
            "estimate_source": { "type": "string" },
            "notes": { "type": "string" }
          }
        }
      }
    },
    "exports": {
      "type": "object",
      "additionalProperties": false,
      "properties": {
        "backend": { "type": "string" },
        "runtime": { "type": "string" },
        "operators": {
          "type": "array",
          "items": { "type": "string" }
        }
      }
    },
    "install": {
      "type": "object",
      "additionalProperties": false,
      "properties": {
        "mode": { "type": "string", "enum": ["image", "build", "external"] },
        "warren": { "type": "boolean" },
        "docker": { "type": "boolean" }
      }
    },
    "acceptance": {
      "type": "object",
      "additionalProperties": false,
      "properties": {
        "target_selector": {
          "type": "object",
          "additionalProperties": true
        },
        "setup_sql": {
          "type": "array",
          "items": { "type": "string" }
        },
        "tests": {
          "type": "array",
          "items": {
            "type": "object",
            "required": ["name", "sql"],
            "additionalProperties": false,
            "properties": {
              "name": {
                "type": "string",
                "pattern": "^[a-z][a-z0-9_\\-]*$"
              },
              "description": { "type": "string" },
              "sql": { "type": "string" }
            }
          }
        },
        "teardown_sql": {
          "type": "array",
          "items": { "type": "string" }
        }
      }
    }
  }
}
