{
  "api_version": "rvbbit.pack/v1",
  "id": "managed/clover",
  "name": "clover",
  "title": "Clover",
  "description": "All of Clover in one subscription: 50 semantic SQL operators — 29 calibrated ML specialists plus 21 LLM operators. ML operators are unmetered on every tier; lanes buy LLM generation speed.",
  "tags": [
    "managed",
    "clover",
    "bundle",
    "specialists",
    "llm",
    "lanes",
    "verified"
  ],
  "catalog_visibility": "public",
  "capability": "capability.json",
  "source": {
    "provider": "rvbbit.ai",
    "model": "clover",
    "url": "https://rvbbit.ai/catalog.json"
  },
  "runtime": {
    "mode": "external",
    "device": "api"
  },
  "exports": {
    "backend": "embed",
    "operators": [
      "clover_means",
      "clover_relevance",
      "clover_similar",
      "clover_embed",
      "clover_entails",
      "clover_contradicts",
      "clover_sentiment",
      "clover_sentiment_score",
      "clover_classify",
      "clover_classify_scores",
      "clover_nli",
      "clover_toxic",
      "clover_moderate",
      "clover_language",
      "clover_language_info",
      "clover_extract",
      "clover_pii",
      "clover_ocr",
      "clover_transcribe",
      "clover_forecast",
      "clover_image_similar",
      "clover_image_embed",
      "clover_cluster",
      "clover_fit",
      "clover_predict",
      "clover_explain",
      "clover_anomaly_fit",
      "clover_anomaly_score",
      "clover_relations",
      "clover_llm_ask",
      "clover_llm_apply",
      "clover_llm_extract",
      "clover_llm_translate",
      "clover_llm_anonymize",
      "clover_llm_canonical",
      "clover_llm_fix",
      "clover_llm_date",
      "clover_llm_means",
      "clover_llm_implies",
      "clover_llm_contradicts",
      "clover_llm_score",
      "clover_llm_supports",
      "clover_llm_valid",
      "clover_llm_steelman",
      "clover_llm_fallacies",
      "clover_llm_same_entity",
      "clover_llm_merge_records",
      "clover_llm_timeline",
      "clover_llm_consensus",
      "clover_llm_make_operator"
    ]
  },
  "install": {
    "mode": "external",
    "warren": false,
    "docker": false
  },
  "catalog_url": "https://rvbbit.ai/catalog.json",
  "catalog_refresh_seconds": 21600,
  "catalog_seed_snapshot": true
}
